{"$id":"urn:alfiq:schema:merchant-policy:v1","$schema":"https://json-schema.org/draft/2020-12/schema","additionalProperties":false,"properties":{"bulk_discount":{"$id":"urn:alfiq:schema:bulk-discount:v1","$schema":"https://json-schema.org/draft/2020-12/schema","additionalProperties":false,"properties":{"min_quantity_same_item":{"minimum":1,"type":"integer"},"percent":{"maximum":100,"minimum":0,"type":"number"}},"required":["min_quantity_same_item","percent"],"type":"object"},"category_limits":{"items":{"$id":"urn:alfiq:schema:category-limit:v1","$schema":"https://json-schema.org/draft/2020-12/schema","additionalProperties":false,"properties":{"category":{"enum":["Copper Bullion Bars","Spa & Wellness","Copper Drinkware","Barware","Coffee & Tea Pots","Oil Dispensers","Kitchen Utensils","Home Accessories","Copper Pendant Lights","Sinks","ALFIQ x Copper Design Collection"]},"max_units_per_order":{"minimum":1,"type":"integer"}},"required":["category","max_units_per_order"],"type":"object"},"type":"array"},"currency":{"const":"USD"},"discount_codes":{"items":{"minLength":1,"type":"string"},"type":"array","uniqueItems":true},"max_quantity_per_line":{"minimum":1,"type":"integer"},"policy_version":{"minLength":1,"type":"string"},"quote_ttl_seconds":{"minimum":1,"type":"integer"},"ship_to_allowed":{"items":{"pattern":"^[A-Z]{2}$","type":"string"},"minItems":1,"type":"array","uniqueItems":true}},"required":["policy_version","currency","max_quantity_per_line","bulk_discount","category_limits","ship_to_allowed","quote_ttl_seconds","discount_codes"],"type":"object"}